{
  "schema_version": "1.0",
  "session_id": "01a15df9-9480-78bd-98a1-a021f6e0e2f9",
  "language": "hi-IN",
  "age_band": "25_34",
  "literacy_band": "with_difficulty",
  "edu_band": "secondary",
  "gender": "woman",
  "device_familiarity": "sometimes",
  "played_before": "no",
  "asr_enabled": false,
  "noise": {
    "noise_floor_dbfs": null,
    "samples": 0
  },
  "headset": false,
  "a11y": {
    "slow_pace": false,
    "volume_boost": false,
    "headset": false,
    "pictogram_storyboard": false,
    "hold_threshold_ms": null
  },
  "practice": {
    "practice_struggle": false,
    "skills_passed": ["tap", "hold", "choice"]
  },
  "battery_arm": "B_fixed",
  "slot_form": "four_stalls",
  "calibration_level": "L2",
  "calibration_policy": "fixed_L2_with_L1_fallback",
  "linkage_flag": true,
  "linked_prior_session_token": null,
  "device": {
    "model": "dev-browser",
    "firmware": "0",
    "hardware_sku": "dev-browser"
  },
  "site_mode": "supervised",
  "mode": "pilot",
  "variant_pack_id": "hi-in.default",
  "completion": "in_progress",
  "walkaway_point": null
}
