{
  "schema_version": "1.0",
  "session_id": "01a15df9-9480-78bd-98a1-a021f6e0e2f9",
  "language": null,
  "age_band": null,
  "literacy_band": null,
  "edu_band": null,
  "gender": null,
  "device_familiarity": null,
  "played_before": null,
  "asr_enabled": false,
  "noise": {
    "noise_floor_dbfs": null,
    "samples": 0
  },
  "headset": false,
  "a11y": {
    "slow_pace": false,
    "volume_boost": false,
    "headset": false,
    "pictogram_storyboard": false,
    "hold_threshold_ms": null
  },
  "practice": {
    "practice_struggle": false,
    "skills_passed": ["tap", "hold", "choice"]
  },
  "battery_arm": null,
  "slot_form": null,
  "calibration_level": null,
  "calibration_policy": "fixed_L2_with_L1_fallback",
  "linkage_flag": false,
  "linked_prior_session_token": null,
  "device": {
    "model": "dev-browser",
    "firmware": "0",
    "hardware_sku": "dev-browser"
  },
  "site_mode": "open_public",
  "mode": "public",
  "variant_pack_id": "hi-in.default",
  "completion": "in_progress",
  "walkaway_point": null
}
